{
  "action": "dispatch",
  "caller": {
    "actor_id": "actor-1",
    "application": "metamusic",
    "instance_id": "metamusic-local-1",
    "origin": {
      "interaction_id": "interaction-1",
      "kind": "explicit_user_acquisition"
    },
    "pairing_id": "pairing-local-1",
    "pairing_revision": 1,
    "workspace_id": "workspace-1"
  },
  "idempotency_key": "idempotency-fixture-explicit",
  "intent_id": "fixture-explicit",
  "items": [
    {
      "confirmation": {
        "approved": true,
        "candidate_ref": "sha256:59e482388e8286e7e36bad786de28bfeca282caba86648e154c637268d164027",
        "confirmation_id": "confirmation-1",
        "confirmed_at": "2026-07-26T18:00:00Z",
        "preview_result_id": "sha256:a753ba63f4239daec189219ae3abdfb946d5bc3723dab99d96b6a1e860028dfe"
      },
      "constraints": {
        "allow_substitution": false,
        "destination": {
          "kind": "metamusic_staging",
          "ref": "staging-target-1"
        },
        "exact_version": true,
        "formats": [
          "FLAC"
        ],
        "media": [
          "WEB"
        ],
        "policy": {
          "authorized_sources_only": true,
          "policy_version": "acquisition-policy-1",
          "private": true
        },
        "rights": {
          "basis": "user_authorized",
          "policy_ref": "rights-policy-1"
        },
        "sources": {
          "allowed_providers": [
            "jackett"
          ],
          "excluded_providers": [
            "soulseek"
          ]
        }
      },
      "item_id": "item-1",
      "search_hints": {
        "artist": "Artist",
        "release": "Release",
        "title": "Track",
        "version": "Extended Mix",
        "year": 2026
      },
      "selection": {
        "candidate_ref": "sha256:59e482388e8286e7e36bad786de28bfeca282caba86648e154c637268d164027",
        "preview_result_id": "sha256:a753ba63f4239daec189219ae3abdfb946d5bc3723dab99d96b6a1e860028dfe"
      },
      "subject": {
        "authority_id": "xref:authority:01ARZ3NDEKTSV4RRFFQ69G5FAV",
        "authority_revision": {
          "event_hash": "sha256:1111111111111111111111111111111111111111111111111111111111111111",
          "sequence": 42
        },
        "entity_kind": "music.recording",
        "exactness": "exact",
        "identity_explanation_hash": "sha256:2222222222222222222222222222222222222222222222222222222222222222",
        "local_id": "xref:entity:01ARZ3NDEKTSV4RRFFQ69G5FAV",
        "portable_refs": [
          "musicbrainz:recording:81c386f6-ecde-480e-8f8d-7af94af61f13"
        ],
        "schema_version": "err.subject/1.0"
      }
    }
  ],
  "schema": "iwantit.acquisition-intent/2"
}
